{
  "SCHEMA": "BRUTUS-TRACE-v0.1",
  "VERSION": "0.1",
  "TRACE_ID": "TRACE-FMIN-Q0001-0001",
  "TRACE_CLASS": "SYNTHETIC_FIXTURE",
  "ANT_ID": "ANT-000000000001",
  "ACTOR_CLASS": "FOURMINIZER_QUEEN",
  "POSITION": "W:START",
  "TICK": 273,
  "CLOCK_AUTHORITY": "QUEEN_SERVER_V0_2",
  "ACTION": "QUERY",
  "INPUT_OBJECTS": [
    "P:184",
    "L:7"
  ],
  "OUTPUT_OBJECTS": [],
  "RESULT": "UNKNOWN",
  "SUCCESS_LEVEL": 0,
  "CONFIDENCE": 0,
  "PARENT_TRACE": null,
  "MESSAGE_ID": "BCM-FOURMINIZER-0001",
  "PROOF_REF": null,
  "SIGNATURE_METHOD": "BRUTUS-CANONICAL-JSON-SHA256-v0.1",
  "SIGNATURE_H256": "02833d01e7eeab2c9e0ec2e6caae0b9a8dcba533d427794ea448ab281f8d4d97",
  "IMMUTABLE": true,
  "EXECUTABLE": false,
  "PROOF_CLAIM": false,
  "GATE_AUTHORITY": false,
  "ROUTING_AUTHORIZATION": "UNDECIDED"
}
